<?xml version="1.0" encoding="utf-8"?>
<xs:schema xmlns:xs="http://www.w3.org/2001/XMLSchema">
  <xs:element name="bookshelf">
    <xs:complexType>
      <xs:sequence>
        <xs:element maxOccurs="unbounded" name="book">
          <xs:complexType>
            <xs:sequence>
              <xs:element name="title" type="xs:string" />
              <xs:element name="author" type="xs:string" />
              <xs:element name="isbn" type="xs:string" />
              <xs:element name="publisher" type="xs:string" />
              <xs:element name="edition" type="xs:string" />
              <xs:element name="price" type="xs:int" />
            </xs:sequence>
          </xs:complexType>
        </xs:element>
      </xs:sequence>
    </xs:complexType>
  </xs:element>
</xs:schema>